{"blender":{"background":true,"executable_sha256":"0060916d6921eb4d46c57254609d805a2ea711917399051391a52ba14beb6327","online_access":false,"process":{"cancelled":false,"returncode":0,"stderr_bytes":390,"stderr_truncated":false,"stdout_bytes":1237,"stdout_truncated":false,"timed_out":false},"version":"5.2.0 LTS"},"blockers":[],"evidence_digest":"1965ad088a721c9774ea536fe908bffa3f8b07a23ac135c22c339f0d778f6627","fixtures":{"rigged":{"artifact":{"bytes":6796,"path":"rigged.glb","sha256":"84e9f0a7c7638566962160d6b986073b37528d8bf944d8840c1b6f99f138175f"},"gltf":{"accessor_count":18,"animation_count":1,"asset_version":"2.0","binary_bytes":2628,"buffer_count":1,"extensions_used":[],"generator":"Khronos glTF Blender I/O v5.2.39","image_count":0,"json_bytes":4138,"material_count":1,"mesh_count":1,"morph_target_count":1,"node_count":4,"scene_count":1,"skin_count":1,"texture_count":0,"total_bytes":6796},"roundtrip":{"roundtrip":{"animation_names":["Wave"],"armature_count":1,"bone_names":["Child","Root"],"material_names":["KDP_RiggedMaterial"],"mesh_count":2,"shape_key_names":["Smile"],"uv_layer_names":["UVMap","UVMap.001"]},"source":{"animation_names":["Wave"],"armature_count":1,"bone_names":["Child","Root"],"material_names":["KDP_RiggedMaterial"],"mesh_count":1,"shape_key_names":["Smile"],"uv_layer_names":["UVMap","UVMap.001"]}}},"static":{"artifact":{"bytes":2832,"path":"static.glb","sha256":"19a8adfbc4c9ac098a676fbdf52143dc5e445b29228830eab67d271341758308"},"gltf":{"accessor_count":6,"animation_count":0,"asset_version":"2.0","binary_bytes":1416,"buffer_count":1,"extensions_used":[],"generator":"Khronos glTF Blender I/O v5.2.39","image_count":0,"json_bytes":1388,"material_count":1,"mesh_count":1,"morph_target_count":0,"node_count":1,"scene_count":1,"skin_count":0,"texture_count":0,"total_bytes":2832},"roundtrip":{"roundtrip":{"animation_names":[],"armature_count":0,"bone_names":[],"material_names":["KDP_StaticMaterial"],"mesh_count":1,"shape_key_names":[],"uv_layer_names":["UVMap","UVMap.001"]},"source":{"animation_names":[],"armature_count":0,"bone_names":[],"material_names":["KDP_StaticMaterial"],"mesh_count":1,"shape_key_names":[],"uv_layer_names":["UVMap","UVMap.001"]}}}},"godot":{"executable_sha256":"12310c74bdda7dcd43f28e971f33047dcecadd436b68169d61ce41009006df38","import":{"cancelled":false,"returncode":0,"stderr_bytes":0,"stdout_bytes":3047,"timed_out":false},"semantic_smoke":{"cancelled":false,"pass_marker":true,"returncode":0,"stderr_bytes":0,"stdout_bytes":359,"timed_out":false},"version":{"compatible_47":true,"major":4,"minor":7,"patch":2,"raw":"4.7.2.stable.steam.ed1daf0bf"}},"platform":{"machine":"AMD64","system":"windows"},"policy_version":"r10.10-local-v1","schema":"kodepoia.r10.gltf_local_acceptance","source_sha":"85e2db277ce1cb467aeb9b056700150bc1d67fa7","status":"pass","version":1}